{
 "countryData": {
  "cardName": "tprhzofrhexiiagajcykstfdbforcdykbhegeube",
  "issuingState": "NO"
 },
 "cardHolder": {
  "name": "Bulic",
  "givenNames": "E",
  "birthDate": "1933-01-01",
  "personalID": "1"
 },
 "competentInstitution": {
  "institutionName": "kogaekcfkhwvoouflntji",
  "institutionID": "CNAM"
 },
 "card": {
  "cardID": "ircoykydfefifpowbvvq",
  "expiryDate": "2055-04-05"
 }
}